710297591871889408,"There's a Mosquito in my room, and I Swear to God if I get Zika, ima kill every single Mosquito on the planet.",1,1,,,,,,,,
693384208027242496,Wtf did I just swallow a mosquito? Zika virus tryna come for me.,1,1,,,,,,,,
783032840283758592,I've gotten bitten by so many Mosquitos I'm surprised I dont have that Zika virus yet.,1,1,1,,,,,,,
782962798892503040,"*Kristi gets one mosquito bite* Kristi: 'great, I probably have the Zika virus.'",1,1,1,,,,,,,
764273156613869568,@CliffBarackman @IronFalcon77 I'd be more concerned about the mosquitos anyway #Zika #nope,1,,,,,,,,,
772380543371579393,ZIKA SPRAYING IS KILLING THE BEES! How Zika Pesticide Spraying Could Eventually Kill Us All https://t.co/Qxm7PYumKt … … @DCClothesline,0,,,,,,,,,
772836058417561600,I have Zika...yesterday I went to wynwood and just discovered a mosquito bite on my back 😳😧,1,1,1,,,,,,,
734731874703183872,"But then it made me think, what if the government is making it rain on us so Zika infected mosquitos have plenty of breeding grounds? 😱",1,,,,,,,,,1
722817260998508544,This Zika-Killing Billboard Lures Mosquitos With the Essence of Human Sweat and Breath- Can I rent one for a cookout https://t.co/nDsAE7fG6F,0,,,,,,,,,
773999629432225792,Collateral Damage: How #Zika #Pesticide Spraying Could Eventually Kill Us All #think... | @scoopit via @HansGruen https://t.co/AO1NKmPxrr,0,,,,,,,,,
767484332734750720,Mosquitoes tore me up in atl. I probably got zika now,1,1,1,,,,,,,
766767695987560449,"Our Zika risk is very low in Washington, but we do have West Nile, so be mindful about preventing mosquito bites. https://t.co/H3fHwPXoLw",1,,,,,,,,,
701709797264117760,It's been years I felt this sick. I like my African mosquitoes like that at least they don't give you #ZikaVirus,1,,,,,,,,,
740860220704837636,Mosquitos in Harris Co have NOT tested positive for Zika but we do have at least 15 cases where people tested positive.,1,,,,,,,,,
725778077905739777,@SenatorReid The Zika mosquitos in my area self-identify as non-Zika-carrying mosquitos https://t.co/V4ijIm17EB,1,,,,,,,,,
696800972958363648,We Have the Technology to Destroy All Zika Mosquitoes https://t.co/5uLkJPRGI2 [h/t @techreview],0,,,,,,,,,
693891549822779394,I know there are some who think #ZikaVirus could be useful in reducing world population. mosquito born contraception and so much more,1,,,,,,,,,1
693098876618801153,ZIKA I am not hearing a PLAN for when warmer weather comes to USA bringing mosquitos WAKE UP We need a plan now NOT LATER WTF,1,,,,,,,,,
733785920042717184,Big thanks to my boy @CarlAzuzCNN for warning us about the zika virus. Just killed like 4 mosquitos. #Azuz4President,1,1,,,,,,,,
777670881015320576,'I feel like I got bit by a mosquito in the butt.' #Zika #NOLA @janay_smith,1,,,,,,,,,