,tweets_VERB
803,"@seca Ayudar con seguridad.  El virus del @Zika, el cual se transmite a través de los mosquitos, provoca... https://t.co/cCUTOGccHh"
3008,Recomendamos Eliminar todas las posibles fuentes de criaderos de mosquitos. #ZikaVirus  FUL PREVENCIÓN @trafficLARA https://t.co/Jbb6dO3GRt
4746,"Crean un método, a base de neumáticos, para combatir el mosquito que transmite el zika https://t.co/85dAfhdbBh"
4997,Confirman 4 casos de zika en Florida contraídos por el mosquito https://t.co/6y67aUeKqW
224,Esterilizan con radiación a mosquitos machos para erradicar el zika:  https://t.co/xezYeFaH3H https://t.co/8L2i4BSSTB
2824,"Elimina los creaderos del mosquito,sin mosquito no hay #Zika https://t.co/5WwnXw0XTR"
4189,Evite la picadura del mosquito Aedes aegypti transmisor del virus Zika; ingrese a: https://t.co/CoKAml9GMi https://t.co/lSZsSFYKYh
3865,Vea ud aquí como repeler al ZIKA y dele Rt colaboremos #buenfindesemana https://t.co/WQ9jJkEjFe
1528,"Evita picaduras de mosquitos, usa repelente de insectos. Puedes prevenir el #ZIKA https://t.co/mAHQBGG0wf https://t.co/KGi0RpvP99"
4330,"Esperaban hacerse de oro con el Zika pero... Dificultades para Oxitec, la empresa de los mosquitos transgénicos https://t.co/iLDf4iaBED"
6757,Hacer un buen uso dl agua almacenada para evitar la propagación dl mosquito q causa el Zika y el Chicungunya hizo @MirianFebres @sggtachira
1505,Aparece un nuevo mosquito que propaga el #Zika conocido como el 'Tigre asiático' ----&gt;https://t.co/C7TtvYvCJe https://t.co/TWCUsO4EQs
6915,"Combaten el zika, vigilan a mosquito por visita del Papa https://t.co/b7zGeuobAo"
2605,"Echan a todos de sus puestos de trabajo pero ojo, cuidemosnos del mosquito matapobres. #AedesAegypti #ZikaVirus  #JuevesIntratable"
5199,Toman medidas para combatir a mosquito portador de Zika:El área de salud @SSalud_mx https://t.co/JV7nKB9F3S #Puebla https://t.co/g9ZiyBjA9T
66,Intensifica Vietnam campaña contra el mosquito para prevenir el zika  https://t.co/YFNRXvgcXc
2433,"Erradicar al mosquito de zika en Brasil, una meta improbable: Entre las décadas de 1940 y… https://t.co/WmhvcTKDEW"
3080,"Volvió el Aedes a #Chile. El mosquito ya sobrevive en agua sucia y clima frío. Porta dengue, zika, chicunguña...  https://t.co/UHn7LjMSUT"
1736,Hallan mosquito transmisor de zika en Chile por primera vez en seis décadas https://t.co/7bSPVJ5eLO
4399,Maté a un mosquito enorme en mi cuarto así que me puse a investigar de tipos de mosquitos por si me daba zika. Me v a dar zika.
766,Identifican a mosquito del zika en cuatro municipios ► https://t.co/wykAhFZCZQ https://t.co/NnRvZD01QR
1830,"Recomiendan reforzar control de #mosquitos en los hogares, luego del monitoreo aédico https://t.co/Ffi7166v0K #dengue #chikungunya #zika"
1954,@AJCortezD La preocupante resistencia del mosquito de zika a los insecticidas https://t.co/5POlMaYKB8
5823,"Creo que con todos los mosquitos que me picaron, si no me agarra dengue o zika, voy a ser inmune toda la vida"
1245,Elimina Ayuntamiento 60 toneladas de criaderos del mosquito transmisor del dengue zika y chikungunya.… https://t.co/Wgk98XgLJi
5791,Sepa cómo protegerse del Zika con este repelente casero y fácil de preparar (+receta) https://t.co/4XGWlGaA6K
6899,Mierda ahí un mosquito molestándo mi 👂🏿 😒🙄 lo apodare como ZIKA😅
1563,Proponen usar murciélagos para acabar con mosquitos que transmiten el zika en Miami Beach https://t.co/GlMmYn4VhY https://t.co/5nZos9LqoU
2834,"Sé más inteligente que el mosquito y dile NO al Zika, siguiendo las recomendaciones de la imagen https://t.co/hqlsGrOWy0"
1375,Controlar a los mosquitos para detener el virus del Zika: Más de la mitad de la población mundial vive en zona... https://t.co/wHPUyEySek
6205,"@super_enid ninguna es una buena razón, ahí hay mosquitos y me da zika."
743,"Protege a tu bebé de cualquier picadura de mosquitos, Dengue o Zika, con las Toallitas Anti-mosquitos de #Pigeon. https://t.co/FAL8ZWcMFd"
6071,Hallan presencia del virus del Zika en mosquitos comunes en Brasil - https://t.co/2Flkc5PZo6 https://t.co/r4CppbtNgo #Brasil
3456,Evitemos la reproducción del mosquito ZIKA. #GNBGarantesDelOrden https://t.co/0B4q4jie9Z
1963,"Ampliarán en Antioquia proyecto que controla el mosquito que transmite el Dengue, Chikunguña y el Zika https://t.co/cA7y1l48eK"
4784,Alertan del riesgo 'real' de contagio del virus zika en las áreas con mosquito tigre https://t.co/IIBGvZQXUo
6429,Vi un mosquito que se parecía a los que te dan Dengue y Zika y me tuve que bañar en repelente y fumigar la casa.
2858,"Traigo toda la cara llena de piquetes de mosquito, ojalá y me dé zika o chicungunya y me muera alv de una vez."
3623,"vieron que estoy enferma? bueno me picó un mosquito, seguro tengo el virus zika y voy a fallecer"
1988,Desarrollan un método para combatir el mosquito 'Aedes' que podría reducir el zika https://t.co/TG3KyGkOuW vía @antena3com
2382,Hallan el mosquito transmisor de zika en Chile por primera vez en 60 años https://t.co/UY8dIuYlPw via @NewsRepublic
5621,"Dejen de meter miedo con el mosquito, si @mauriciomacri es mas peligroso q el zica, el dengue y la chimoltriufia juntas!!!"
2782,"Evita la picadura de mosquitos para prevenir la infección por #Zika, #Dengue o #Chikungunya #SiNoTePicaNoTeDaZika https://t.co/EqaUoapSg6"
5875,Examinar lago en Parque de Costa del Este como criadero de los muchos MOSQUITOS del area. #Zika @raisabanfield @jblandonc @mauidesaint
6178,"Irradiar mosquitos como medida para luchar contra el virus #Zika , no veo que puede salir mal en ese plan.. https://t.co/AK8iejFUNY"
2064,Confirman hallazgo de primer mosquito que transmite el virus Zika en... Re:Bourdieu-Pensamiento y accion https://t.co/kQWwaCIxMe
3350,Realizarán experimentos nucleares con mosquitos en el país para contrarestar zika https://t.co/kd8WuIXx2d
1802,"@gabrielrufian Antes de qu nacieras seguro q a tu madre le pico el mosquito del zica, vamos eso es seguro. Más tontos es difícil encontrar."
4607,Crean mosquitos genéticamente modificados para erradicar el virus de Zika https://t.co/ZMUgpaQfSd
4491,Aumentan las evidencias de que otros mosquitos también pueden transmitir el zika
4031,Exhorta eliminar criaderos de mosquitos por amenaza del zika - https://t.co/ItvDU8H9A2 https://t.co/AYqhwBz3Pg
1901,Hallan virus del Zika en glándulas salivales de mosquito común https://t.co/mKO1diakNi https://t.co/7ur4TbXzQC
640,Reportan 10 casos más de zika en Florida; podrían ser por picadura de mosquitos locales https://t.co/PMfPqT6SIX
1138,Buscarán proteger a mujeres embarazadas del Zika https://t.co/G1Oley87sZ https://t.co/9oMSZs1T9a
2178,Protege a tus bebes y niños contra el mosquito que transmite el virus del Zika. Disponible en #QuePequeños... https://t.co/awVZk8GwQ8
5012,Estudian plantas carnívoras contra mosquito del zika en Argentina https://t.co/0jNzFFA905
559,Informando sobre como protegernos del ZIKA https://t.co/aRlMJFSrMy
5450,Evita contraer #Zika y otros males alejando a los mosquitos con: https://t.co/moCzWzSzu7 https://t.co/25Kuwsw1TH https://t.co/JfJ3bh898s
897,Confirman la presencia de mosquitos portadores de zika en Miami https://t.co/XEvLXc5UQ0
1162,"Sigue estos consejos y acaba con los criaderos del mosquito del Zika, Dengue y Chikungunya #TodosSomosBrigadistas https://t.co/YISzFJhv6p"
5922,@veraalcivard Te invitamos a conocer nuestra página para tener más información del zika https://t.co/qPPzXr1jH5 #MoscaConLosMosquitos
804,@Abriendo_Brecha todos contra el mosquito del Zika. Formenos parte de estos operativos empezando por nuestra casa
3601,Erradicar mosquitos que propagan Zika en Miami es “una tarea difícil” (+fotos)  https://t.co/deYe1vJTc4 #Wynwood #Florida #EEUU #ZikaMiami
3710,abrí la ventana me picaron 73 mosquitos andá a saber si entre tantos el dengue o el zika ya me veo muerta
1119,"Evitemos el Zika, el Dengue y la Chikunguya. Eliminemos los criaderos de mosquitos para frenar estas enfermedades https://t.co/v1S0WNnyo2"
662,Fumiga tu hogar y evita el contagio de Zika y Dengue #MoscaConLosMosquitos https://t.co/Yz3Oug5EJN https://t.co/4Im9mxd9ke
6730,Estudian en China uso de mosquitos infectados con zica contra virus https://t.co/UbKEIHZ9EW
491,"Erradicar al mosquito de zika en Brasil, una meta improbable https://t.co/k7eP0l8gz4"
3399,Conoce cómo protegerte del zika en la programación de AYRE1 https://t.co/kKZSneatP2
2142,"Evita enfermedades transmitidas por mosquitos, di no al  #zika #chikungunya y #dengue https://t.co/wakXv4PeBi"
752,Aleja al mosquito que transmite #chikungunya #dengue y #zika usando repelentes  https://t.co/mUpq6sYSij https://t.co/T3QQxKnIrH
4316,"Esperaban hacerse de oro con el Zika pero...  Dificultades para Oxitec, la empresa de los mosquitos transgénicos https://t.co/INdj3kIJjI"
1374,Controlar a los mosquitos para detener el virus del Zika https://t.co/WK2BXjVL9o
1223,Hallan presencia del virus del Zika en mosquitos comunes en Brasil https://t.co/rYsQebQdUs #NoticiaSiguiente #28Jul #FelizJueves
4616,"Evita enfermedades transmitidas por mosquitos, di no al  #zika #chikungunya y #dengue https://t.co/NRoDCYuenN"
3790,#aceras rotas criaderos de mosquitos #Zika y #dengue #ptaPca @MINSA_Panama @BlandonJose @AAUD_Panama a controlarlo https://t.co/02XcR9dszT
3256,Controlar los mosquitos para detener el Zika https://t.co/RFVI7aMcgV https://t.co/zCmirBZ2Mr
2489,"Detectan mosquito Aedes en Chile, hay riesgo de zika: Todo indica que el mosquito entró a territorio chileno p... https://t.co/Xlrvidmvsj"
4003,"Ve este vídeo 30 seg de @CDCgov para saber cómo protegerte, a tu familia y a tu comunidad del #ZikaVirus #VirusZika https://t.co/nf1UBH9uTe"
1907,Aleja a toda clasede mosquitos y prevén #Chikungunya #zika #dengue https://t.co/0Ly4PNPFIg https://t.co/vKrfr9elt9 https://t.co/36jDV7vmr4
3984,"#noticias #salud EEUU: Casos de zika contraídos por mosquito aumentaría a 14: WYNWOOD, Florida, EE.UU. (AP) —... https://t.co/GlR9tZEaCH"
3291,"Quieres tener un BB o familiar retrasado y de pequeña cabeza? NO verdad, entonces ataquemos al ZIKA destruyendo los criaderos de mosquitos."
2086,Llega a Chile mosquito que transmite el zika https://t.co/HwSqpZxdST
3692,Combatir el zika con mosquitos mutantes https://t.co/gTkeIh0UaF
2507,"Detectan mosquito Aedes en #Chile, hay riesgo de #zika     https://t.co/K8hbI426Uy https://t.co/ASC8OTqfsJ"
5089,“Combatir el zika tratando solo de erradicar al mosquito no funcionará” https://t.co/9Eij3FLIRz vía el_pais
836,Hallan larvas del mosquito transmisor del zika en  poblado de Camarones https://t.co/s5neSJYlU3 vía @emol
2601,Conozca las recomendaciones básicas para protegerse del zika https://t.co/inwY8ohPBJ
5039,Miren la radiografía del azaroso mosquito del zika. https://t.co/sNgKrSo8SI
1800,"Tenemos la obligación de evitar la proliferación mosquitos transmisores del Dengue, la Chikungunya y el virus Zika (alerta epidemiológica)"
6602,"Necesito dormir Y ME ACABA DE PICAR UN MOSQUITO, ojalá no sea el zika por que zikagué."
3530,Evite la picadura con ropa que cubran sea posible y elimine depósito de cría de mosquitos #Virus #CasonitaTips #Zika https://t.co/XGxcB63Fw0
5560,"Confirma @SSDurango que #Durango está libre de casos del virus del Zika, sin embargo el mosquito transmisor se ubica en 20 municipios."
1995,Crean en #Chile un repelente para el mosquito portador del virus #Zika https://t.co/teEpkhaErx https://t.co/GzdLmYMNqW
2893,"Salio la 2da parte de 5 pe pal vino. Que ganas de que me piquen 11 mosquitos y me dejen zika, dengue, chikungunya, fiebre amarilla y ebola"
6776,#vamospormas #erradicar #criaderos #mosquito #zikavirus #dengue #chikungunya #prevenir #salud #privadosdelibertadRD https://t.co/RxMtgF2OyM
5649,Atribuyen virus del Zika a mosquitos modificados genéticamente por compañía británica Oxitec https://t.co/h1pNebpHoZ https://t.co/kzn5hQ9VFX
3220,Empieza la Temporada de Mosquitos en #USA y crece el temor al #Zika. https://t.co/IaGI9CRwBo
2472,Encuentran en Chile mosquito que transmite virus del Zika – LaTercera (Registro) https://t.co/7PeyipFhrV
5589,"Evita La Picadura De Mosquito, Cuidate Del Zika, Usando Este Repelente Casero “No Toxico” -... https://t.co/SvVNvIYOLG"
